{
  "prompt_id": "IP2",
  "asset_id": "A2",
  "scene_id": "S2",
  "subject_lock": {
    "entity_ids": [
      "fridge_01"
    ],
    "canonical_description": "A dark charcoal/black freestanding two-door top-freezer refrigerator matching the supplied product reference: rectangular body, upper freezer door smaller than lower refrigerator door, thin silver horizontal divider/trim between doors, minimal recessed vertical black handles along the left edge, flat dark side panels, compact household proportions.",
    "must_preserve": [
      "dark charcoal/black body color",
      "top-freezer two-door layout",
      "upper freezer door smaller than lower refrigerator door",
      "thin silver horizontal divider between doors",
      "recessed vertical handle geometry on the left side",
      "same height-to-width proportions as the product reference",
      "same flat-sided rectangular body design"
    ],
    "must_not_change": [
      "do not convert to French-door, side-by-side, single-door, or bottom-freezer layout",
      "do not change body color to white or stainless steel",
      "do not add external water/ice dispenser",
      "do not add large protruding handles",
      "do not change door proportions",
      "do not invent a different appliance model"
    ]
  },
  "environment": {
    "location": "Ordinary modern home kitchen with enough clearance around the refrigerator to view its side/rear area.",
    "fixed_elements": [
      "warm light-wood cabinetry",
      "light neutral wall",
      "simple light-colored tile or wood-look floor",
      "one small green plant or modest kitchen accessory",
      "no people"
    ],
    "allowed_changes": [
      "small crop adjustments",
      "subtle camera repositioning required by each scene",
      "minor background blur consistent with the same kitchen"
    ],
    "forbidden_changes": [
      "no showroom or appliance-store setting",
      "no industrial kitchen",
      "no dramatic location change",
      "no neon or sci-fi environment",
      "no unrelated refrigerator in the background"
    ]
  },
  "lighting": {
    "style": "Natural residential daylight with soft practical kitchen fill.",
    "direction": "Main daylight from camera-right/front-right; soft fill from room lighting.",
    "intensity": "Moderate, realistic indoor exposure; refrigerator surfaces remain dark but readable.",
    "color_temperature": "Neutral-warm daylight, approximately household natural-light appearance.",
    "consistency_rules": [
      "keep shadow direction consistent across A1/A2/A5/A6",
      "avoid dramatic rim light or studio spotlight",
      "do not make the refrigerator glossy or mirror-like"
    ]
  },
  "appearance": {
    "materials": [
      "matte or satin dark-coated metal refrigerator exterior",
      "thin brushed-metal/silver divider trim",
      "ordinary painted kitchen walls",
      "wood cabinetry",
      "realistic floor material"
    ],
    "surface_finish": [
      "subtle real-world texture",
      "small natural reflections only",
      "no perfect CGI plastic smoothness"
    ],
    "realism_notes": [
      "ordinary lived-in kitchen, not a product advertisement set",
      "physically plausible contact shadows and floor reflections",
      "straight edges remain geometrically consistent",
      "no melted, duplicated, or warped appliance parts"
    ]
  },
  "output_spec": {
    "aspect_ratio": "9:16",
    "width": 1080,
    "height": 1920,
    "transparent_background": false
  },
  "operation": "derive_scene",
  "reference_asset_ids": [
    "A1"
  ],
  "continuity_constraints": [
    "A1 is the authoritative identity and environment reference.",
    "Do not replace or redesign fridge_01.",
    "Preserve refrigerator geometry, proportions, materials, kitchen, shadow direction, and camera-family continuity."
  ],
  "scene_intent": {
    "narration": "Tủ lạnh không tạo ra cái lạnh. Nó lấy nhiệt từ khoang bên trong rồi chuyển nhiệt ra môi trường.",
    "visual_goal": "Create a controlled explanatory cutaway from A1 that shows heat being removed from the cold compartment and transferred toward the exterior, without inventing a fully detailed refrigeration system.",
    "viewer_should_understand": [
      "heat leaves the cooled interior rather than 'cold' being created",
      "the process belongs to this same refrigerator",
      "heat flow is from inside the cooled compartment toward the outside"
    ]
  },
  "camera": {
    "view": "Same rear three-quarter camera family as A1; preserve the refrigerator silhouette and environment.",
    "angle": "Match A1 within a few degrees; no arbitrary rotation.",
    "distance": "Same medium full-body framing as A1.",
    "height": "Match A1 camera height.",
    "framing": "Vertical 9:16; full refrigerator remains visible.",
    "perspective": "Match A1 perspective exactly.",
    "lens_style": "Match A1 lens character."
  },
  "composition": {
    "subject_position": "Match A1 placement.",
    "crop_rules": [
      "do not crop refrigerator silhouette",
      "do not move refrigerator relative to floor/wall",
      "keep rear region available for later technical continuation"
    ],
    "background_visibility": "Keep the same kitchen and same background relationship as A1.",
    "negative_space": "Preserve A1 negative space.",
    "layering": [
      "base layer: A1 identity",
      "cutaway layer: semi-transparent interior zone",
      "overlay layer: heat-flow arrows"
    ]
  },
  "required_visual_elements": [
    {
      "element": "same refrigerator from A1",
      "placement": "exact same midground position",
      "state": "unchanged exterior silhouette",
      "purpose": "continuity"
    },
    {
      "element": "semi-transparent cutaway of cooled interior compartment",
      "placement": "inside lower refrigerator compartment, contained within body silhouette",
      "state": "subtle transparent reveal, not exploded view",
      "purpose": "show where heat is removed"
    },
    {
      "element": "heat-flow arrows",
      "placement": "start inside cooled compartment and travel toward exterior/rear heat-rejection direction",
      "state": "clear, simple, 2–3 arrows maximum",
      "purpose": "show direction of heat transfer"
    }
  ],
  "technical_overlay": {
    "overlay_type": "simplified heat-transfer overlay",
    "elements": [
      "semi-transparent cooled compartment region",
      "2–3 heat-flow arrows"
    ],
    "directions": [
      "all heat arrows must point from inside the cooled compartment toward the exterior/rear; never point from room into the cold compartment"
    ],
    "labels": [
      "optional short label 'Nhiệt' near arrows only if needed"
    ],
    "must_not_imply": [
      "do not imply cold is injected into the compartment",
      "do not show flames",
      "do not show a complete invented refrigeration loop yet"
    ]
  },
  "allowed_transforms": [
    "make selected body region semi-transparent",
    "add simple heat arrows",
    "add subtle interior cool-zone indication"
  ],
  "technical_constraints": [
    "Do not invent detailed compressor/condenser geometry in A2.",
    "Heat arrow direction is mandatory: inside → outside.",
    "Keep overlay educational and diagram-like rather than photorealistic glowing energy."
  ],
  "negative_constraints": [
    "do not convert to French-door, side-by-side, single-door, or bottom-freezer layout",
    "do not change body color to white or stainless steel",
    "do not add external water/ice dispenser",
    "do not add large protruding handles",
    "do not change door proportions",
    "do not invent a different appliance model",
    "no new refrigerator",
    "no camera jump",
    "no different kitchen",
    "no heat arrows pointing inward",
    "no flames",
    "no exaggerated red-hot rear panel",
    "no opened doors"
  ],